{
  "schema_version": 1,
  "schema_uri": "https://qedgen.dev/schemas/auditor/spec-handoff-v1.schema.json",
  "spec_path": "fee-vault.qedspec",
  "layers": {
    "structural": [
      {
        "candidate_id": "AccountOwnerCheck:program",
        "disposition": "emitted",
        "spec_path": "fee-vault.qedspec",
        "verification_lanes": ["check"]
      }
    ],
    "domain": [
      {
        "candidate_id": "qty_fee_amount",
        "kind": "quantity",
        "disposition": "needs_authoring",
        "verification_lanes": ["manual", "crucible"]
      }
    ],
    "regression": []
  },
  "language_gaps": [
    {
      "candidate_id": "qty_fee_amount",
      "reason": "unit_or_rounding_semantics",
      "disposition": "document_or_extend_language"
    }
  ]
}
